{
  "contractVersion": "2.0.0",
  "projectId": "proj-7f3a2b",
  "modelVersion": 14,
  "readinessStatus": "partial",
  "readinessDetail": "Level 2 masonry reconstruction is task-ready for crack documentation; level 1 remains not-ready pending coverage of the east elevation.",
  "objectCount": 218,
  "updatedAt": "2026-01-15T10:05:00.000Z"
}
